restaurant_name,district,tier,phone_found,instagram_or_social,best_contact_channel,utm_link,suggested_opening_line,notes
Trattoria Sole,Tây Hồ,A,Not found,Not verified,Walk-in / manual verification,https://mamji.vn/?utm_source=email&utm_medium=outreach&utm_campaign=tay_ho_pilot&utm_content=trattoria_sole,"Mình thấy quán theo hướng Italian dine-in ở Tây Hồ, nên nếu có một vài tối đầu tuần chưa kín bàn, MÂM có thể thử giúp lấp những slot đó bằng khách đã đặt trước.",Search results were noisy and did not confidently identify the Hanoi business. Verify Instagram/address before contact.
Salmonoid Restaurant,Tây Hồ,A,0911 023 432; 02432 000 628,Instagram / Tripadvisor,Phone / Instagram DM,https://mamji.vn/?utm_source=email&utm_medium=outreach&utm_campaign=tay_ho_pilot&utm_content=salmonoid,"Mình thấy Salmonoid là concept restaurant khá rõ về trải nghiệm ăn tại chỗ; nếu có khung giờ weekday chưa kín bàn, MÂM có thể thử fill bằng khách đã đặt trước.","Location mismatch: CSV says Tây Hồ but public source shows 32C Cao Bá Quát, Ba Đình. Consider moving out of Tây Hồ pilot."
Souperman,Tây Hồ,B,Not found,Instagram,Instagram DM / walk-in,https://mamji.vn/?utm_source=email&utm_medium=outreach&utm_campaign=tay_ho_pilot&utm_content=souperman,"Mình thấy The Souperman Kitchen là brunch spot mới ở Tây Hồ, nên MÂM có thể giúp test thêm khách cho các khung giờ weekday còn vắng mà không cần phí cố định.",No public email found. IG DM or walk-in is likely better than email.
Eggscape,Tây Hồ,A,0978 42 43 41,Instagram,Phone / Instagram DM,https://mamji.vn/?utm_source=email&utm_medium=outreach&utm_campaign=tay_ho_pilot&utm_content=eggscape,"Mình thấy Eggscape là brunch concept mới ở Tây Hồ, rất hợp để thử lấp thêm khách vào weekday late morning hoặc lunch bằng khách đã đặt trước.",No public email found. Phone and IG are public in search snippets.
Butter Brunch & Brioche,Tây Hồ,C,096 887 7793; 034 212 2246,Instagram,Phone / Instagram DM,https://mamji.vn/?utm_source=email&utm_medium=outreach&utm_campaign=tay_ho_pilot&utm_content=butter_brunch_brioche,"Mình thấy Butter Brunch & Brioche có brunch/dine-in vibe rất hợp Tây Hồ; nếu quán có khung giờ weekday chưa kín bàn, MÂM có thể thử fill khách mà không phát sinh phí cố định.","Address snippets conflict: 11A/11 Tây Hồ, 46A alley 31 Xuân Diệu, and 46 alley 52 Tô Ngọc Vân appear in results. Verify before outreach."
Avos&Mango,Tây Hồ,C,086 590 2161,Instagram / Facebook / Vietcetera,Phone / Instagram DM,https://mamji.vn/?utm_source=email&utm_medium=outreach&utm_campaign=tay_ho_pilot&utm_content=avos_and_mango,"Mình thấy Avos&Mango là brunch/cafe khá quen ở Tây Hồ; nếu có vài weekday slots muốn tăng thêm covers mà không chạy discount đại trà, MÂM có thể thử rất nhẹ.",No email found. Public phone/Zalo is available in snippets.
Milk & Honey,Tây Hồ,C,0877 321 810; 0357 702 821,Instagram @milk_and_honey_hanoi / Facebook,Instagram DM / phone / walk-in,https://mamji.vn/?utm_source=email&utm_medium=outreach&utm_campaign=tay_ho_pilot&utm_content=milk_and_honey,"Mình thấy Milk & Honey là brunch/cafe-restaurant ở Tây Hồ, mở từ sáng đến tối nên có thể có một vài khung giờ đẹp nhưng chưa luôn kín bàn; MÂM có thể thử fill các slot đó bằng khách đã đặt trước.",No public email found. Recommend IG DM or walk-in. Strong fit for Tây Hồ pilot despite Tier C.
Gather,Tây Hồ,C,Not found,Tripadvisor / social mentions,Walk-in / Instagram search,https://mamji.vn/?utm_source=email&utm_medium=outreach&utm_campaign=tay_ho_pilot&utm_content=gather,"Mình thấy Gather là một Tây Hồ spot có cộng đồng riêng; nếu có weekday slots chưa kín bàn, MÂM có thể thử giúp thêm khách mà không cần phí cố định.",No email visible in snippets. Need verify current official Instagram/contact before outreach.
